{
  "$schema": "https://json-schema.org/draft/07/schema#",
  "$id": "https://mstefanko-plugins/swarm-do/permissions.schema.json#v1",
  "title": "swarm-do role permission preset",
  "type": "object",
  "required": ["schema_version", "role", "merge_policy", "permissions"],
  "additionalProperties": false,
  "properties": {
    "_generated": { "type": "string" },
    "schema_version": { "type": "integer", "enum": [1] },
    "role": {
      "type": "string",
      "pattern": "^[a-z][a-z0-9-]*$"
    },
    "merge_policy": { "type": "string", "enum": ["deny-wins"] },
    "permissions": {
      "type": "object",
      "required": ["allow"],
      "additionalProperties": false,
      "properties": {
        "allow": {
          "type": "array",
          "items": { "type": "string" },
          "uniqueItems": true
        },
        "deny": {
          "type": "array",
          "items": { "type": "string" },
          "uniqueItems": true
        }
      }
    }
  }
}
