{
  "_generated": "generated from role-specs/agent-<name>.md \u2014 do not edit; run `python3 -m swarm_do.roles gen --write` to update",
  "merge_policy": "deny-wins",
  "permissions": {
    "allow": [
      "Bash(bd:*)",
      "Read"
    ],
    "deny": [
      "Bash(rg:*)",
      "Edit",
      "Glob",
      "Grep",
      "Write"
    ]
  },
  "role": "research-merge",
  "schema_version": 1
}
