{
  "_generated": "generated from role-specs/agent-<name>.md \u2014 do not edit; run `python3 -m swarm_do.roles gen --write` to update",
  "merge_policy": "deny-wins",
  "permissions": {
    "allow": [
      "Bash(bin/swarm providers doctor:*)",
      "Bash(bin/swarm providers evidence:*)",
      "Bash(bin/swarm-provider-review:*)",
      "Bash(claude --help:*)",
      "Bash(claude --version:*)",
      "Bash(claude -p:*)",
      "Bash(claude auth status:*)",
      "Bash(codex --version:*)",
      "Bash(codex exec:*)",
      "Bash(codex login status:*)",
      "Bash(git diff:*)",
      "Bash(git show:*)",
      "Bash(rg:*)",
      "Read"
    ],
    "deny": []
  },
  "role": "provider-review",
  "schema_version": 1
}
