{
  "_generated": "generated from role-specs/agent-<name>.md \u2014 do not edit; run `python3 -m swarm_do.roles gen --write` to update",
  "merge_policy": "deny-wins",
  "permissions": {
    "allow": [
      "Bash(bd:*)",
      "Bash(python3:*)",
      "Bash(rg:*)",
      "Bash(sed:*)",
      "Edit",
      "Read",
      "Write"
    ],
    "deny": [
      "Bash(git:*)"
    ]
  },
  "role": "plan-normalizer",
  "schema_version": 1
}
